{
  "schema_version": "1.0",
  "run_id": "stage2a-run-01",
  "project": "Murkin1980/murat-project-engineer",
  "task": "Create the Stage 2 experiment plan and a durable STATUS.md continuation point after the v1.0 release.",
  "start_timestamp": "2026-08-10T19:31:26Z",
  "end_timestamp": "2026-08-10T19:31:37Z",
  "risk_tier": "FAST",
  "playbook": "baseline/no-playbook",
  "experts_invoked": [],
  "route_profiles": [],
  "files_changed": ["STAGE2_EXPERIMENT_PLAN.md", "STATUS.md"],
  "commands_tools_used": ["GitHub connector"],
  "deterministic_gate_results": [
    {"gate_id": "clean_diff_scope", "result": "PASS", "evidence_ref": "commits 5d0d32f and cf253e3 each contain the intended documentation/status change"},
    {"gate_id": "secrets_scan", "result": "NOT_OBSERVABLE", "evidence_ref": null},
    {"gate_id": "build", "result": "NOT_APPLICABLE", "evidence_ref": "documentation-only baseline"},
    {"gate_id": "typecheck", "result": "NOT_APPLICABLE", "evidence_ref": "documentation-only baseline"},
    {"gate_id": "lint", "result": "NOT_APPLICABLE", "evidence_ref": "documentation-only baseline"},
    {"gate_id": "unit_tests", "result": "NOT_APPLICABLE", "evidence_ref": "documentation-only baseline"},
    {"gate_id": "rollback_available", "result": "PASS", "evidence_ref": "Git commits 5d0d32f and cf253e3 are independently revertible"},
    {"gate_id": "deep_change_check", "result": "PASS", "evidence_ref": "STAGE2_EXPERIMENT_PLAN.md explicitly preserves Option A+ boundaries"}
  ],
  "judge_verdict": null,
  "approvals": [],
  "rework_count": null,
  "outcome": "PASS",
  "unresolved_risks": ["Historical baseline: execution duration, reviewer activity, secrets scan and model route were not observable."],
  "rollback": "Revert commits 5d0d32ff0c87e6e16ae6b2599aa17e0310d5c16c and cf253e3e060890674e2236522ae00e4dc651a73b.",
  "approximate_usage_cost": null,
  "source_refs": ["commit:5d0d32ff0c87e6e16ae6b2599aa17e0310d5c16c", "commit:cf253e3e060890674e2236522ae00e4dc651a73b"],
  "artifact_refs": ["STAGE2_EXPERIMENT_PLAN.md", "STATUS.md"],
  "handoff_refs": [],
  "baseline_run": true,
  "interruption_resume": false,
  "architecture_pressure": []
}
