{
  "schema_version": "1.0",
  "run_id": "RUN-08",
  "project": "Murat Project Engineer",
  "task": "Controlled BrowserAct evaluation as a public-web browser/evidence acquisition capability using an Almaty custom-kitchen market snapshot.",
  "start_timestamp": "2026-08-14T00:00:00+05:00",
  "end_timestamp": "2026-08-15T00:00:00+05:00",
  "risk_tier": "VERIFIED",
  "playbook": "verified",
  "experts_invoked": ["Researcher", "Reviewer"],
  "route_profiles": ["research/extraction/normalization -> opencode-go/deepseek-v4-flash"],
  "files_changed": ["docs/evaluations/BROWSERACT_EVALUATION.md", "docs/evaluations/BROWSER_ACQUISITION_ROLE.md", "evidence/stage2/RUN-08_REPORT.json", "evidence/stage2/RUN-08_EXPERIMENT_RECORD.json", "evidence/stage2/run-08/browseract_almaty_kitchen_snapshot.json"],
  "commands_tools_used": ["Agent Reach/Jina Reader", "Codex Router", "BrowserAct skill 2.0.2", "browser-act CLI 1.4.0", "isolated local Chrome", "package validator", "unit tests"],
  "deterministic_gate_results": [
    {"gate_id":"deep_change_check","result":"PASS","evidence_ref":"No repository, service, queue, store, scheduler, production dependency, core-model change, or Router authority expansion."},
    {"gate_id":"secrets_scan","result":"PASS","evidence_ref":"Public pages only; no credentials, cookies, private profile, customer data, or secrets stored."},
    {"gate_id":"public_data_only","result":"PASS","evidence_ref":"PUBLIC_WEB_ONLY; no authentication, forms, messaging, purchase, or CAPTCHA bypass."},
    {"gate_id":"clean_diff_scope","result":"PASS","evidence_ref":"Only five RUN-08 artifacts were added; unrelated pre-existing worktree changes were preserved."},
    {"gate_id":"build","result":"NOT_APPLICABLE","evidence_ref":"Documentation/evidence-only pilot; no product or package build inputs changed."},
    {"gate_id":"typecheck","result":"NOT_APPLICABLE","evidence_ref":"No typed source code changed."},
    {"gate_id":"lint","result":"NOT_APPLICABLE","evidence_ref":"No linted source code changed."},
    {"gate_id":"unit_tests","result":"PASS","evidence_ref":"python -m unittest discover: 5 tests passed."},
    {"gate_id":"rollback_available","result":"PASS","evidence_ref":"Remove the five RUN-08 artifacts; no product dependency or runtime integration exists."},
    {"gate_id":"artifact_exists","result":"PASS","evidence_ref":"Two evaluation documents, two RUN-08 records, and compact dataset created."},
    {"gate_id":"schema_or_json_validation","result":"PASS","evidence_ref":"Host command used C:\\Python313\\python.exe with jsonschema 4.26.0 (available in the approved host environment) and jsonschema.validate(instance, schema) for RUN-08_REPORT.json vs contracts/RUN_REPORT.schema.json and RUN-08_EXPERIMENT_RECORD.json vs contracts/EXPERIMENT_RECORD.schema.json, plus dataset count/unique URL/domain assertions. Exit 0; output: schema and metric gates PASS. The restricted sandbox Python lacks this module; the Markdown/JSON naming split is recorded as a risk."},
    {"gate_id":"duplicate_check","result":"PASS","evidence_ref":"29 unique record_id values; no effective duplicate classified."},
    {"gate_id":"source_url_presence","result":"PASS","evidence_ref":"Every dataset record contains a public source_url."},
    {"gate_id":"decision_vocabulary","result":"PASS","evidence_ref":"New Idea Filter and terminal BrowserAct decision use REUSE_COMPONENT."}
  ],
  "judge_verdict": "PASS",
  "approvals": ["User requested full execution and Codex Router usage.", "User approved creation of the isolated public-only Chrome browser.", "User separately confirmed deletion of the isolated pilot Chrome after the deletion plan was presented."],
  "rework_count": 1,
  "outcome": "PASS",
  "unresolved_risks": ["BrowserAct uv shim fails on the Cyrillic Windows user path; direct installed executable works.", "Large page markdown can be truncated; targeted extraction is required.", "External service cost was not observable; local Chrome incurred no observed charge.", "The repository Experiment Record Markdown template and JSON schema use different field names; RUN-08 follows the JSON schema pending canonical-precedence clarification.", "Direct-fetch failures, two retries, and same-session stability outputs are operator-observed; compact raw execution logs were not committed."],
  "rollback": "Isolated pilot Chrome chrome_local_112664527734046828 was deleted after explicit confirmation and the browser list was verified empty. To roll back repository evidence, remove the five RUN-08 artifacts; the agent-level BrowserAct skill/CLI may be uninstalled separately. No product dependency exists.",
  "approximate_usage_cost": "0 observed for local Chrome; external service cost UNKNOWN",
  "source_refs": ["docs/NEW_IDEA_FILTER_POLICY.md", "STAGE2_EXPERIMENT_PLAN.md", "https://docs.browseract.com/", "https://github.com/browser-act/skills", "https://www.browseract.com/privacy-policy", "https://www.browseract.com/pricing"],
  "artifact_refs": ["docs/evaluations/BROWSERACT_EVALUATION.md", "docs/evaluations/BROWSER_ACQUISITION_ROLE.md", "evidence/stage2/RUN-08_EXPERIMENT_RECORD.json", "evidence/stage2/run-08/browseract_almaty_kitchen_snapshot.json"],
  "handoff_refs": [],
  "baseline_run": false,
  "interruption_resume": true,
  "architecture_pressure": []
}
