{
  "schema_version":"1.0",
  "run_id":"RUN-09",
  "project":"Murat Project Engineer / Salamat Kitchen Configurator",
  "task":"Controlled Personalized Assessment Engine v0 experiment using a kitchen project assessment with synthetic scenarios.",
  "start_timestamp":"2026-08-15T00:00:00+05:00",
  "end_timestamp":"2026-08-15T01:00:00+05:00",
  "risk_tier":"VERIFIED",
  "playbook":"verified",
  "experts_invoked":["Coder","Reviewer"],
  "route_profiles":["repository-boundary review -> opencode-go/deepseek-v4-pro"],
  "files_changed":["salamat-kitchen-configurator/src/assessment/*","salamat-kitchen-configurator/src/app/App.tsx","salamat-kitchen-configurator/src/app/app.css","salamat-kitchen-configurator/tests/assessment/assessment.test.ts","docs/evaluations/PERSONALIZED_ASSESSMENT_ENGINE_V0.md","evidence/stage2/RUN-09_REPORT.json"],
  "commands_tools_used":["Codex","Codex Router","npm check","Vitest","TypeScript","ESLint","Vite"],
  "deterministic_gate_results":[
    {"gate_id":"new_idea_filter","result":"PASS","evidence_ref":"EXPERIMENT recorded; target decision EXTEND_EXISTING; no new repository."},
    {"gate_id":"deep_change_check","result":"PASS","evidence_ref":"No persistence, queue, scheduler, agent graph, external SaaS, production flow or domain rewrite."},
    {"gate_id":"classification_scenarios","result":"PASS","evidence_ref":"12/12 expected classifications passed."},
    {"gate_id":"number_authority","result":"PASS","evidence_ref":"Outcome composer receives immutable deterministic facts and does not calculate prices."},
    {"gate_id":"recommendation_traceability","result":"PASS","evidence_ref":"Every recommendation ruleId exactly matches deterministic recommendationRuleIds."},
    {"gate_id":"typecheck_lint_tests_build","result":"PASS","evidence_ref":"npm.cmd run check: 35/35 tests passed; typecheck, lint and Vite build passed."},
    {"gate_id":"production_exposure","result":"PASS","evidence_ref":"Local files only; no deployment, personal data, CRM, WhatsApp or analytics."}
  ],
  "judge_verdict":"REWORK",
  "approvals":["User explicitly requested implementation of CODEX_PERSONALIZED_ASSESSMENT_ENGINE_V0_EXPERIMENT.md."],
  "rework_count":2,
  "outcome":"REWORK",
  "unresolved_risks":["Production price rules are unavailable.","External LLM output was not evaluated.","Target directory has no Git metadata.","Target in-repo master instruction remains a placeholder."],
  "rollback":"Remove src/assessment, tests/assessment and restore the prior debug App.tsx/app.css. No external or production state changed.",
  "approximate_usage_cost":"No external runtime/API cost observed.",
  "source_refs":["CODEX_PERSONALIZED_ASSESSMENT_ENGINE_V0_EXPERIMENT.md","salamat-mebel-kz/SALAMAT_KITCHEN_CONFIGURATOR_MASTER_INSTRUCTION.md","salamat-kitchen-configurator/AGENTS.md","business-discovery/FOUNDATION.md"],
  "artifact_refs":["docs/evaluations/PERSONALIZED_ASSESSMENT_ENGINE_V0.md","salamat-kitchen-configurator/src/assessment","salamat-kitchen-configurator/tests/assessment/assessment.test.ts"],
  "handoff_refs":[],
  "baseline_run":false,
  "interruption_resume":false,
  "architecture_pressure":[]
}
