{
  "schema_version": "1.0",
  "run_id": "stage2a-run-03",
  "project": "Murkin1980/mebeldocs-ai",
  "task": "Complete the first vertical slice from order to invoice to PDF with domain validation, state machine, storage, API, UI and audit evidence.",
  "start_timestamp": null,
  "end_timestamp": "2026-07-17T21:38:32Z",
  "risk_tier": "VERIFIED",
  "playbook": "baseline/no-playbook",
  "experts_invoked": [],
  "route_profiles": [],
  "files_changed": [
    "CHECKPOINT.md",
    "DECISIONS.md",
    "PROJECT_PROGRESS.md",
    "ROADMAP.md",
    "SESSION_NOTES.md",
    "apps/web/lib/domain/",
    "apps/web/lib/storage/local-repositories.ts",
    "apps/web/lib/application/",
    "apps/web/app/api/",
    "apps/web/app/orders/",
    "apps/web/app/invoices/",
    "apps/web/lib/pdf-generator.ts",
    "apps/web/tests/domain.test.ts",
    "apps/web/tests/integration.test.ts",
    "apps/web/tests/pdf.test.ts"
  ],
  "commands_tools_used": ["historical Git commit evidence", "GitHub connector"],
  "deterministic_gate_results": [
    {"gate_id": "artifact_exists", "result": "PASS", "evidence_ref": "commit b578621a6fb0544bfd111dec10c63a62320f0fb0 and CHECKPOINT.md"},
    {"gate_id": "typecheck", "result": "PASS", "evidence_ref": "commit CHECKPOINT records TypeScript tsc --noEmit with 0 errors"},
    {"gate_id": "build", "result": "PASS", "evidence_ref": "commit CHECKPOINT records production build PASS with 19 routes"},
    {"gate_id": "unit_tests", "result": "PASS", "evidence_ref": "commit records 89 unit tests plus existing tests within 103 total passing"},
    {"gate_id": "integration_tests", "result": "PASS", "evidence_ref": "commit records 6 integration tests passing"},
    {"gate_id": "acceptance_tests", "result": "NOT_OBSERVABLE", "evidence_ref": "no separate historical acceptance-run artifact inspected"},
    {"gate_id": "lint", "result": "NOT_APPLICABLE", "evidence_ref": "commit explicitly records ESLint was not configured in that repository state"},
    {"gate_id": "secrets_scan", "result": "NOT_OBSERVABLE", "evidence_ref": null},
    {"gate_id": "rollback_available", "result": "PASS", "evidence_ref": "historical Git commit is revertible"},
    {"gate_id": "deep_change_check", "result": "NOT_OBSERVABLE", "evidence_ref": "baseline predates MPE classification"}
  ],
  "judge_verdict": null,
  "approvals": [],
  "rework_count": null,
  "outcome": "PASS",
  "unresolved_risks": [
    "PDF Cyrillic did not render with Helvetica in this baseline and was explicitly recorded as a known limitation.",
    "ESLint was not configured in this repository state."
  ],
  "rollback": "Revert commit b578621a6fb0544bfd111dec10c63a62320f0fb0 if this historical vertical slice must be removed.",
  "approximate_usage_cost": null,
  "source_refs": ["commit:b578621a6fb0544bfd111dec10c63a62320f0fb0", "Murkin1980/mebeldocs-ai:CHECKPOINT.md"],
  "artifact_refs": ["github:Murkin1980/mebeldocs-ai@b578621a6fb0544bfd111dec10c63a62320f0fb0"],
  "handoff_refs": [],
  "baseline_run": true,
  "interruption_resume": false,
  "architecture_pressure": []
}
