{
  "schema_version": "1.0",
  "run_id": "stage2a-run-02",
  "project": "Murkin1980/furniture-configurator",
  "task": "Add a parametric wardrobe configurator, product switching, formula pricing, new option types, URL serialization support and WhatsApp adaptation.",
  "start_timestamp": null,
  "end_timestamp": "2026-05-27T13:51:45Z",
  "risk_tier": "VERIFIED",
  "playbook": "baseline/no-playbook",
  "experts_invoked": [],
  "route_profiles": [],
  "files_changed": [
    "index.html",
    "src/config.js",
    "src/imageResolver.js",
    "src/options.css",
    "src/options.js",
    "src/price.css",
    "src/price.js",
    "src/pricing.js",
    "src/schema.js",
    "src/urlSerializer.js"
  ],
  "commands_tools_used": ["historical Git commit evidence", "GitHub connector"],
  "deterministic_gate_results": [
    {"gate_id": "artifact_exists", "result": "PASS", "evidence_ref": "commit 840ab06e5830487697504fac6a6dcb4b1d5bacf3"},
    {"gate_id": "clean_diff_scope", "result": "PASS", "evidence_ref": "commit diff is scoped to configurator product/UI/pricing/schema behavior"},
    {"gate_id": "unit_tests", "result": "NOT_OBSERVABLE", "evidence_ref": "no CI status or test result attached to inspected commit"},
    {"gate_id": "integration_tests", "result": "NOT_OBSERVABLE", "evidence_ref": "no CI status or test result attached to inspected commit"},
    {"gate_id": "acceptance_tests", "result": "NOT_OBSERVABLE", "evidence_ref": "current README documents the resulting parametric features but historical acceptance execution is unavailable"},
    {"gate_id": "secrets_scan", "result": "NOT_OBSERVABLE", "evidence_ref": null},
    {"gate_id": "rollback_available", "result": "PASS", "evidence_ref": "historical Git commit is revertible"},
    {"gate_id": "deep_change_check", "result": "NOT_OBSERVABLE", "evidence_ref": "baseline predates MPE classification"}
  ],
  "judge_verdict": null,
  "approvals": [],
  "rework_count": null,
  "outcome": "PASS",
  "unresolved_risks": ["Historical baseline has no observable CI/test run or reviewer record."],
  "rollback": "Revert commit 840ab06e5830487697504fac6a6dcb4b1d5bacf3 if this historical feature must be removed.",
  "approximate_usage_cost": null,
  "source_refs": ["commit:840ab06e5830487697504fac6a6dcb4b1d5bacf3", "Murkin1980/furniture-configurator:README.md"],
  "artifact_refs": ["github:Murkin1980/furniture-configurator@840ab06e5830487697504fac6a6dcb4b1d5bacf3"],
  "handoff_refs": [],
  "baseline_run": true,
  "interruption_resume": false,
  "architecture_pressure": []
}
