{
  "schema_version": "1.0",
  "run_id": "RUN-10",
  "project": "Murat Project Engineer / Munder Difflin controlled pilot",
  "task": "Evaluate Munder Difflin v0.4.3 through a controlled three-role benchmark and source analysis without changing Option A+ boundaries.",
  "start_timestamp": "2026-08-15T00:00:00+05:00",
  "end_timestamp": "2026-08-15T23:59:00+05:00",
  "risk_tier": "VERIFIED",
  "playbook": "verified",
  "experts_invoked": ["Architect", "Coder/Analyst", "Reviewer"],
  "route_profiles": ["Munder Difflin -> Codex gpt-5-codex"],
  "files_changed": ["docs/evaluations/MUNDER_DIFFLIN_EVALUATION.md", "docs/evaluations/MUNDER_MPE_COMPONENT_MATRIX.md", "docs/evaluations/MUNDER_REUSE_DECISION.md", "evidence/stage2/RUN-10_REPORT.json", "evidence/stage2/RUN-10_EXPERIMENT_RECORD.json"],
  "commands_tools_used": ["Munder Difflin 0.4.3 portable", "Codex", "Git", "GitHub API", "agent-reach/Jina", "npm focused tests", "source inspection"],
  "deterministic_gate_results": [
    {"gate_id": "new_idea_filter", "result": "PASS", "evidence_ref": "Primary disposition EXPERIMENT; existing MPE repository used."},
    {"gate_id": "binary_integrity", "result": "PASS", "evidence_ref": "Official and local SHA-256 matched: E99E375C4905DACB23302A91E2F30ED5686D023D62F4028FB32F4554A3AE7D2B."},
    {"gate_id": "three_functional_roles", "result": "FAIL", "evidence_ref": "0/3 roles reached a working Munder terminal; GOD/Codex exited immediately with code 0."},
    {"gate_id": "observable_handoffs", "result": "FAIL", "evidence_ref": "No benchmark task or handoff executed."},
    {"gate_id": "privacy_local_first", "result": "PASS", "evidence_ref": "Isolated local paths; telemetry disabled; DO_NOT_TRACK=1."},
    {"gate_id": "deep_change_check", "result": "PASS", "evidence_ref": "No MPE runtime, architecture, Router, credential, or production state changed."},
    {"gate_id": "source_tests", "result": "NOT_OBSERVABLE", "evidence_ref": "npm install failed on better-sqlite3/Windows C++ toolchain; focused suite lacked TypeScript."},
    {"gate_id": "rollback_available", "result": "PASS", "evidence_ref": "Stop portable process and discard isolated C:\\tmp hive/clone; MPE benchmark clone remained unchanged."}
  ],
  "judge_verdict": "BLOCKED",
  "approvals": ["User explicitly requested the experiment.", "User explicitly authorized running the downloaded portable executable."],
  "rework_count": 0,
  "outcome": "BLOCKED",
  "unresolved_risks": ["Munder Codex adapter exits immediately on this Windows environment.", "Worktree, mailbox, budget, breaker and handoff behavior remain unverified at runtime.", "Portable Windows build is unsigned.", "PreToolUse hook was not active during the final configuration."],
  "rollback": "No benchmark repository changes occurred. Stop Munder; isolated pilot state can be discarded after review.",
  "approximate_usage_cost": "No external product/API cost observed; local Codex attempts only.",
  "source_refs": ["CODEX_MUNDER_DIFFLIN_CONTROLLED_ARCHITECTURE_PILOT.md", "Munder Difflin v0.4.3 source", "README.md", "docs/OPERATING_MODEL.md", "contracts/HANDOFF.md", "gates/registry.yaml"],
  "artifact_refs": ["docs/evaluations/MUNDER_DIFFLIN_EVALUATION.md", "docs/evaluations/MUNDER_MPE_COMPONENT_MATRIX.md", "docs/evaluations/MUNDER_REUSE_DECISION.md"],
  "handoff_refs": [],
  "baseline_run": false,
  "interruption_resume": "PARTIAL: configuration/hive persisted, but no task resumed.",
  "architecture_pressure": ["Typed mailbox transport", "Append-only event vocabulary", "Ephemeral worktree/lifecycle metadata"]
}
