{
  "schema_version": "1.0",
  "run_id": "RUN-11",
  "project": "Murkin1980/murat-project-engineer",
  "task": "Implement and validate lightweight runtime coordination patterns: typed mailbox transport, compact append-only events, and ephemeral lifecycle/worktree metadata.",
  "start_timestamp": "2026-08-15T13:00:00+05:00",
  "end_timestamp": "2026-08-15T15:00:00+05:00",
  "risk_tier": "VERIFIED",
  "playbook": "verified",
  "experts_invoked": ["Researcher", "Implementer", "Reviewer"],
  "route_profiles": ["independent review -> opencode-go/deepseek-v4-pro via Codex Router"],
  "files_changed": ["contracts/MAILBOX_ENVELOPE.schema.json", "contracts/RUNTIME_EVENT.schema.json", "contracts/AGENT_RUNTIME_STATE.schema.json", "scripts/runtime_coordination.py", "tests/test_runtime_coordination.py", "docs/architecture/RUNTIME_COORDINATION_PATTERNS.md", "gates/registry.yaml", "scripts/validate_package.py", ".gitignore", "evidence/runtime/RUN-11.events.jsonl", "evidence/stage2/run-11/HANDOFF_RESEARCHER_TO_IMPLEMENTER.md", "evidence/stage2/run-11/HANDOFF_IMPLEMENTER_TO_REVIEWER.md", "evidence/stage2/RUN-11_REPORT.json", "evidence/stage2/RUN-11_EXPERIMENT_RECORD.json"],
  "commands_tools_used": ["Codex", "Codex Router", "Python unittest", "package validator", "Git diff checks", "runtime simulation"],
  "deterministic_gate_results": [
    {"gate_id": "new_idea_filter", "result": "PASS", "evidence_ref": "EXTEND_EXISTING recorded by RUN-11 specification."},
    {"gate_id": "mailbox_schema_valid", "result": "PASS", "evidence_ref": "Valid/missing-role/status/timestamp/partial/duplicate tests passed."},
    {"gate_id": "handoff_traceable", "result": "PASS", "evidence_ref": "Two typed HANDOFF artifacts and envelope trace fields validated."},
    {"gate_id": "event_log_valid", "result": "PASS", "evidence_ref": "10 ordered events validated and summarized deterministically."},
    {"gate_id": "worktree_collision_check", "result": "PASS", "evidence_ref": "Same-worktree writers detected; distinct worktrees allowed."},
    {"gate_id": "terminal_state_valid", "result": "PASS", "evidence_ref": "Allowed transitions pass; terminal-to-WORKING rejected without new invocation."},
    {"gate_id": "unit_tests", "result": "PASS", "evidence_ref": "21/21 tests passed after Router hardening and Windows duplicate-path correction (16 new, 5 existing)."},
    {"gate_id": "clean_diff_scope", "result": "PASS", "evidence_ref": "RUN-11 scoped files only; unrelated pre-existing untracked files preserved."},
    {"gate_id": "secrets_scan", "result": "PASS", "evidence_ref": "Scoped scan found no credential material."},
    {"gate_id": "deep_change_check", "result": "PASS", "evidence_ref": "No daemon, scheduler, database, persistent agent, shared memory, new orchestrator, Router authority change, or new repository."}
  ],
  "judge_verdict": "PASS",
  "approvals": ["User requested RUN-11 and explicitly requested Codex Router usage."],
  "rework_count": 2,
  "outcome": "PASS",
  "unresolved_risks": ["Atomic publication is scoped to one filesystem.", "JSONL is evidence for bounded writers, not a multi-process event broker."],
  "rollback": "Remove the three schemas, runtime helper/tests/note/RUN-11 evidence; remove the five new gates and validator references; revert the mailbox gitignore entry.",
  "approximate_usage_cost": "Codex Router independent review plus local execution; exact cost not observable.",
  "source_refs": ["Munder Dufflin/CODEX_MPE_RUNTIME_PATTERNS_EXTENSION_RUN11.md", "docs/evaluations/MUNDER_REUSE_DECISION.md", "contracts/HANDOFF.md", "contracts/RUN_REPORT.schema.json"],
  "artifact_refs": ["docs/architecture/RUNTIME_COORDINATION_PATTERNS.md", "evidence/runtime/RUN-11.events.jsonl", "evidence/stage2/RUN-11_EXPERIMENT_RECORD.json"],
  "handoff_refs": ["evidence/stage2/run-11/HANDOFF_RESEARCHER_TO_IMPLEMENTER.md", "evidence/stage2/run-11/HANDOFF_IMPLEMENTER_TO_REVIEWER.md"],
  "baseline_run": false,
  "interruption_resume": false,
  "architecture_pressure": []
}
