{
  "schema_version": "1.0",
  "run_id": "RUN-12",
  "project": "Murkin1980/murat-project-engineer",
  "task": "Prepare and run EXP-12 CLEARS deterministic triage/executability backtest as an Option A+ extension.",
  "start_timestamp": "2026-08-18T10:00:00+05:00",
  "end_timestamp": "2026-08-18T12:00:00+05:00",
  "risk_tier": "VERIFIED",
  "playbook": "verified",
  "experts_invoked": ["Implementer", "Reviewer"],
  "route_profiles": ["independent review -> opencode-go/deepseek-v4-pro via Codex Router"],
  "files_changed": ["scripts/triage_engine.py", "contracts/TRIAGE_INPUT.schema.json", "contracts/TRIAGE_OUTPUT.schema.json", "tests/test_triage_engine.py", "tests/test_runtime_coordination.py", "datasets/exp-12-backtest.json", "docs/experiments/EXP-12_CLEARS_TRIAGE.md", "docs/experiments/EXPERIMENT_REPORT_TEMPLATE.md", "evidence/backtest/EXP-12_BACKTEST_RESULTS.json", "evidence/stage2/RUN-12_REPORT.json", "evidence/stage2/RUN-12_EXPERIMENT_RECORD.json", "README.md", "STATUS.md", "STAGE2_EXPERIMENT_PLAN.md", "CHANGELOG.md", "tests/test_contracts.py"],
  "commands_tools_used": ["Codex", "Codex Router", "Python unittest", "package validator", "deterministic backtest"],
  "deterministic_gate_results": [
    {"gate_id": "new_idea_filter", "result": "PASS", "evidence_ref": "EXPERIMENT disposition recorded in docs/experiments/EXP-12_CLEARS_TRIAGE.md."},
    {"gate_id": "backtest_case_count", "result": "PASS", "evidence_ref": "20 traceable cases in datasets/exp-12-backtest.json."},
    {"gate_id": "retrospective_fixture_agreement", "result": "PASS", "evidence_ref": "20/20 fixture agreement; evidence/backtest/EXP-12_BACKTEST_RESULTS.json."},
    {"gate_id": "prospective_accuracy", "result": "NOT_OBSERVABLE", "evidence_ref": "Inputs and expected labels were curated from the same retrospective evidence."},
    {"gate_id": "deep_change_recall", "result": "PASS", "evidence_ref": "Zero expected DEEP-CHANGE false negatives."},
    {"gate_id": "unit_tests", "result": "PASS", "evidence_ref": "37 tests passed; 2 platform privilege skips."},
    {"gate_id": "package_validation", "result": "PASS", "evidence_ref": "scripts/validate_package.py returned VALIDATION PASSED."},
    {"gate_id": "deep_change_check", "result": "PASS", "evidence_ref": "Stateless helper only; no service, persistence, autonomous execution or Router authority change."}
  ],
  "judge_verdict": "PASS",
  "approvals": ["User requested EXP-12 with disposition EXPERIMENT and requested Codex Router usage."],
  "rework_count": 2,
  "outcome": "PASS",
  "unresolved_risks": ["Retrospective labels and explicit input ratings were curated from the same known evidence, so 100% fit is not evidence of prospective generalization.", "The score named deep_change_probability is a deterministic heuristic score, not a calibrated statistical probability.", "Prospective pre-registered cases are required before operational reliance."],
  "rollback": "Remove EXP-12 additive files and revert README, STATUS, Stage 2 plan, changelog and contract-test range updates.",
  "approximate_usage_cost": "Codex Router independent analysis/review plus local execution; exact cost not observable.",
  "source_refs": ["STAGE2_EXPERIMENT_PLAN.md", "STATUS.md", "docs/OPERATING_MODEL.md", "evidence/stage2/RUN-11_REPORT.json"],
  "artifact_refs": ["docs/experiments/EXP-12_CLEARS_TRIAGE.md", "datasets/exp-12-backtest.json", "evidence/backtest/EXP-12_BACKTEST_RESULTS.json"],
  "handoff_refs": [],
  "baseline_run": false,
  "interruption_resume": false,
  "architecture_pressure": []
}
